,,,,5,What is the maximum safe load of a raft related to?,通用知识推理,The type and size of the raft.,木筏的最大安全负载。,根据马克对木筏最大安全负载的解释，提到了用垃圾箱做木筏，用到了多少个垃圾箱可推出。,,,,,,,,,,
32,https://www.youtube.com/watch?v=K4MhCvraJeE,20:05,探索 - 体验新事物,1,What is Stephanie's occupation?,人物属性建模,Specialists in the study of endangered wolf species.,,根据Coyote介绍可知斯蒂芬妮是研究濒危狼物种的专家。,,,,,,,,,,
,,,,2,Does the fennec fox need extra water in addition to eating?,通用知识推理,Fennel foxes do not require additional water.,"耳廓狐需水量少,除了进食时吸收水分之外不需要额外补充水分。",根据斯蒂芬妮介绍耳廓狐甚至一生都找不到饮用水，仅靠植物中的水便可以生存，可推出耳廓狐的需水量少，除了进食时吸收水分之外不需要额外补充水分。,,,,,,,,,,
,,,,3,Who is Daisy?,多模态/多语言推理,She is a fennec fox.,,纳齐尔拿着食物嘴里叫着黛西，镜头转向一只耳廓狐，结合视觉，可知黛西就是一只耳廓狐。,,,,,,,,,,
,,,,4,What sounds are fennec foxes more sensitive to?,通用知识推理,A shrill voice.,耳廓狐对尖细的声音很敏感。,当纳齐耳用尖细的声音对耳廓狐说话时，耳廓狐会向他靠近。,,,,,,,,,,
,,,,5,Does Regina have extensive expertise?,人物属性建模,"Yes,she is.",,根据Regina指导纳齐尔的过程中可知她具有丰富的专业知识。,,,,,,,,,,
33,https://www.youtube.com/watch?v=iNPX0IGHR4c,20:36,教学 - 技能,1,What structure can reinforce the wheel well area?,"多模态/多语言推理,通用知识推理", An I-beam.,I型梁是一种常用的结构设计，具有高强度和抗弯能力。I型梁的设计能够最大程度地分散和承受压力，特别适用于需要承受弯曲负载的区域。,视频内容：Chris介绍fish house上车轮井的设计时提到他们选用了I型梁这种牢固的结构。——>推理：车轮井区域的结构设可以选用I型梁。。,,,,,,,,,,
,,,,2,Why use a 2×3 frame for building a Fish House?,通用知识推理," Lighter than 2×4, stronger than 2×2, suitable for transport.",2×4框架、2×3框架 和 2×2框架 表示木材的木材规格，单位是英寸（inch），通常用于建筑结构中的框架搭建。,视频内容：Chris将2×4框架、2×3框架和2×2框架进行对比，指出论坛上广受好评的2×2框架只适用于小型建筑，不能满足公路运输的需求。——>推理：Fish house这种大型设备需要使用2×3框架，因为2×3框架比2×4更轻，比2×2更坚固，适应公路运输。,,,,,,,,,,
,,,,3,Is Chris a humurous blogger ?,"多线索推理,人物属性建模","Yes, he is.",,视频内容：在视频制作中，Chris为视频增加了外星人送来材料的特效和板材很沉的戏剧情节。——>推理：Chris是一个幽默的博主。,,,,,,,,,,
,,,,4,Is woodworking a family tradition in Chris's family?,人物属性建模,"Yes, it is.",,视频内容：Chris提到Randy（Chris的爷爷）、他的爸爸和自己都从事木工制作。——>推理：，在Chris家从事木工制作是一种家庭传统文化。,,,,,,,,,,
,,,,5,What did Chris and his father do before cutting the wood?,多跳推理,They lifted all the wood to the second floor.,,模型需要定位到与切割木材相关的片段，然后结合前后内容进行分析。,,,,,,,,,,
34,https://www.youtube.com/watch?v=ny2jWBwKYXo,28:25,测评 - 其他,1,"Is the relationship between Kara and Nate “intimate” or “distant""? ",人物属性建模,Intimate.,,通过观察视频里，Kara和Nate的互动，如眼神言语等细节，由此可知两人的关系是情侣，而非陌生。,,,,,,,,,,
,,,,2,Why doesn't Saudia serve or allow alcohol on its flights?,通用知识推理,Because Saudi Airlines(Saudia) is a dry airline.,干航空公司是指飞行中不提供酒精饮料服务，甚至禁止乘客携带酒精饮品登机的航空公司，通常是因所在国家或地区的文化、宗教、法律等因素而如此规定。,通过定位到开头Kara说道这是自己在上飞机前的最后一次喝酒，那是因为Saudi Airlines是一家干航空公司，在飞机上不允许也不提供酒精饮料的服务。,,,,,,,,,,
,,,,3,Is Kara's personality lively or introverted?,"多线索推理,人物属性建模",Lively.,,通过观察Kara的行为，如夸张的表情、丰富的语言等细节，由此可知，Kara的性格是活泼开朗的。,,,,,,,,,,
,,,,4,Is there a time limit for passengers in the first class of Saudia when dining? ,通用知识推理,No.,沙特航空（Saudia）头等舱的用餐服务以“无时间限制”为核心优势。乘客可在飞行中的任何阶段（除起飞/降落等关键阶段）要求供餐，无固定餐次限制。例如：凌晨2点可要求现做阿拉伯早餐或烤羊排。,通过定位视频里Kara介绍菜单的片段，说道在整个飞行过程中几乎可以随时随地点餐。由此可知，其用餐是没有时间限制的。,,,,,,,,,,
,,,,5,What did Nate order for himself after having dinner? ,多跳推理,A piece of cheesecake and a cup of tea.,,通过定位到视频里，当Kara和Nate吃晚餐的片段后，即可知Nate在之后给自己又点了一块芝士蛋糕和一杯茶。,,,,,,,,,,
35,https://www.youtube.com/watch?v=fjQ_zNoclO4,26:32,vlog - 居家,1,What does the blogger have an allergic reaction to?,人物属性建模,Wool,,博主说她的皮肤排斥羊毛，任何一点的羊毛都会使她湿疹发作，可推出,,,,,,,,,,
,,,,2,What kind of person is the new landlord?,人物属性建模,Generous,,博主说房东送给她一个私人桑拿房作为乔迁礼物，可见房东是一个慷慨的人,,,,,,,,,,
,,,,3,Where did Ashley sleep?,多模态/多语言推理,On the sofa,,定位到博主和 Ashley 打招呼的片段，利用视觉可知 Ashley 在沙发上睡觉,,,,,,,,,,
,,,,4,What are the drawbacks of the felt clothes hanger?,通用知识推理,The felt clothes hanger will break,毛毡衣架有会断裂的缺点,博主说她觉得毛毡衣架很舒服，但它们会断裂，可推断出,,,,,,,,,,
,,,,5,What services does Roadway offer?,通用知识推理,Move house,Roadway提供搬家服务,定位到视频开头，博主提到”我们会在Roadway的帮助下把东西都搬出去“，”他（Jack）总是自己搬家，我作为一个专业人士让专业人士去做这个“，可推断出,,,,,,,,,,
36,https://www.youtube.com/watch?v=fNHBNL52YAc,33:03,vlog - 运动,1,"What brand is ""Care/of""?",通用知识推理,Wellness brand,Care/of是健康护理品牌,定位到介绍Care/of的片段，博主提到”你们可能没听说过Care/of，这是一个健康护理品牌，生产高质量的维生素、蛋白质和营养剂“，可推断出,,,,,,,,,,
,,,,2,"Which is more difficult, doing abdominal exercises on the bed or on the floor?",通用知识推理,On the bed,在床上做腹部训练比地板上难,博主说她因为这些床上腹部训练会比较放松，实际上它们比在地板上更难，可推断出,,,,,,,,,,
,,,,3,What is Anna's personality like?,"人物属性建模,多模态/多语言推理",Active,,从视频中Anna吃甜点时在镜头前跳舞可以看出Anna是一个性格活泼的人,,,,,,,,,,
,,,,4,What is the relationship between the blogger and Andrew?,"人物属性建模,多模态/多语言推理",Couple,,视频开头片段博主说Andrew在自己额头上留下了吻痕，结合视频片段可以看出二人住在一起，可推断出二人是夫妻,,,,,,,,,,
,,,,5,What did the blogger do after completing the warm-up exercises?,多线索推理,Bed abdomen workouts,,结合视频片段可以看出博主做完热身运动做了床上腹部训练,,,,,,,,,,
37,https://www.youtube.com/watch?v=WnCMvZ-Rv0k,24:46,vlog - 居家,1,"When ordering takeout from Super Noodles, are the side dishes and noodles packed separately or together?","多线索推理,多模态/多语言推理,通用知识推理",Separately,Super Noodles店内的食物外带时配菜和面条是分装的,定位到博主买面条的片段，听觉得知店名，视觉博主回家后吃面时面与配菜是分装的，可得到答案,,,,,,,,,,
,,,,2,Does the blogger like the kind of clothes that expose the navel?,人物属性建模,No,,博主买了一个很合身的衣服，她说衣服很合身，但她希望它可以更长一点，还说自己的肚子露出来了，这是难看的合身，可推断出,,,,,,,,,,
,,,,3,Where did the blogger purchase a trash can?,多线索推理,At ROSS,,从视频片段可以看出博主去了一家名为ROSS的超市，在展示衣服时介绍了自己放在购物车的粉色垃圾桶,,,,,,,,,,
,,,,4,Who is Liz?,"人物属性建模,多模态/多语言推理",The blogger's sister,,利用听觉，博主说自己的姐姐给自己挑了一件衣服，后面博主让Liz展示自己挑的衣服，利用视觉可知给博主挑衣服的就是Liz，可推断出,,,,,,,,,,
,,,,5,Should the price tags of MarsShalls be affixed to the goods themselves or on the shelves?,通用知识推理,To the goods themselves ,MarsShalls的价格标签在商品上贴着,定位到博主看包的片段可以看到包包上有MarsShalls的标签，推断出商店名字为MarsShalls，利用视觉可知商品的标签都在商品上贴着,,,,,,,,,,
38,https://www.youtube.com/watch?v=xf2DPY3vGto,20:22,测评 - 电子产品,1,"After comparing the battery capacity of the phones, what did the blogger compare?","多线索推理,多跳推理",Camera,,定位到对比手机电池的片段，跟踪博主行为可得到答案,,,,,,,,,,
,,,,2,"In terms of mobile phone batteries, what does the blogger value more?","人物属性建模,多模态/多语言推理",Battery capacity,,视频前面提到iPhone13pro电池容量比三星22Ultra大，在比较充电速度和电池容量的优势时，右边博主指着iPhone说这是自己真正信任的手机，所以右边博主更看重电池容量,,,,,,,,,,
,,,,3,What is the proportion of recycled materials used on average in Apple devices?,通用知识推理,Twenty percent,苹果设备平均使用20%的回收材料,定位到比较环保方面的片段，博主提到，苹果设备平均使用20%的回收材料，可得到答案,,,,,,,,,,
,,,,4,What aspect of the mobile phone camera does Marquez pay more attention to?,人物属性建模,Stability,,Marquez提到自己喜欢iPhone的相机，在右边博主介绍过安卓手机在相机上更优秀的几个点后Marquez说自己余生都会选择最稳定可靠的，可推荐出,,,,,,,,,,
,,,,5,How does Apple's performance in environmental protection compare to that of Android devices?,通用知识推理,Better,iPhone比安卓机更环保,博主提到iPhone平均使用20%的再生材料，这是目前行业中最多的，并且苹果公司打算在2030年达到碳中和，比大多数其他手机公司更早,,,,,,,,,,
39,https://www.youtube.com/watch?v=zyUqg2FBO-I,22:12,测评 - 电子产品,1,Is Linus good at assembling computers?,人物属性建模,"Yes, he is.",,找到作者安装电脑的片段，并得出答案。,,,,,,,,,,
,,,,2,Does the author prefer more cost-effective computers?,人物属性建模,"Yes, he favors PCs with good price-performance ratio.",,找到作者谈论电脑价格的片段，并据此得出答案。,,,,,,,,,,
,,,,3,Why does the order of inserting RAM sticks affect performance?,"多线索推理,多模态/多语言推理,通用知识推理","Inserting them in the wrong order may disable dual-channel mode, leading to reduced performance.",内存条插入顺序错误会导致双通道失效，从而影响性能。,找到相关发现性能受损的片段，并根据多条线索推理出答案。,,,,,,,,,,
,,,,4,Will removing the protective film on the heatsink inside the case affect performance?,"多模态/多语言推理,通用知识推理",No.,散热器上的保护膜，撕不撕主要影响美观和散热器长期积灰，但对显卡的散热和性能无直接影响。,找到作者撕下散热器保护膜的片段，并根据当段的画面与语音推理出答案。,,,,,,,,,,
,,,,5,Why the first person to recognize the author felt that today was his lucky day?,多线索推理,Because he is the fan of the author.,,找到相应片段，并根据对话与画面判断出答案。,,,,,,,,,,
40,https://www.youtube.com/watch?v=IA9LlfQ9X-Q,26:24,测评 - 生活用品,1,What does the author think about endoscopy?,人物属性建模,Pretty useful.,,找到作者试用内窥镜的片段，并据此得出答案。,,,,,,,,,,
,,,,2,Why do some products in YouTube ads completely disappear after a while?,通用知识推理,Because those low-quality items get taken down.,视频网站上的广告有些是低劣商品，面临着随时下架的风险。,找到相关购买网站上广告中商品的片段，并据此推理出答案。,,,,,,,,,,
,,,,3,What is the relationship between these two video creators?,"多线索推理,人物属性建模",They are the bosses and employees.,,通过视频整体各个线索可以推理出两人之间的关系。,,,,,,,,,,
,,,,4,How does a projector connect to a phone?,"多线索推理,多模态/多语言推理,通用知识推理",Bluetooth.,蓝牙可以将投影仪与手机连接在一起。,找到对应投影仪的片段，并根据画面与语音推理出答案。,,,,,,,,,,
,,,,5,How to play music on the light projector that the author bought?,"多线索推理,多模态/多语言推理",Connect the headphones via Bluetooth.,,找到对应试用灯光投影仪的片段，并根据画面与声音得出答案。,,,,,,,,,,
41,https://www.youtube.com/watch?v=FJOtPRD_7hM,20:34,测评 - 展会,1,Is the scale of the IMTS trade show large or small?,通用知识推理,Large.,IMTS（International Manufacturing Technology Show） 是全球规模最大、最具影响力的工业制造技术贸易展之一，聚焦尖端机床、智能制造与工业创新。,通过定位到视频开头，Ian说道imts 是一个大型贸易展，是世界上或至少在北美最大的机械加工展会之一，所有大型机械加工制造商都会聚集，由此可知IMTS的规模大，而不是小。,,,,,,,,,,
,,,,2,Is Ian good at communicating or inarticulate? ,"多线索推理,人物属性建模",He is good at communicating.,,通过观察视频，视频中Ian在和各个负责人交谈中清楚提问、清晰表达等细节，由此可知，ian是善于沟通的。,,,,,,,,,,
,,,,3,What kind of technology is the power skiving unit?,通用知识推理,Cutting-edge technology.,动力滑行单元（Power Skiving Unit） 不仅是前沿技术，更是当前齿轮制造领域最具颠覆性的技术突破之一，其核心在于通过 “运动控制算法+多工艺集成” 实现了传统机械加工无法企及的效率、精度和柔性化水平。,通过定位到视频里ian在和patrick的交谈中，说道这项技术是非常先进的，可以帮助提高精确度和效率等，由此可知这是一项高端制造领域的尖端技术。,,,,,,,,,,
,  ,,,4,Who did Ian interview after interviewing Jacob?,多跳推理,Shawn.,,定位到视频里，Ian再采访完Jacob后，采访了Shawn。,,,,,,,,,,
,,,,5,"Which word is more appropriate to describe Brendt, ""professional"" or ""amateur""? ",人物属性建模,Professional.,,视频定位到Brendt的讲解，通过观看视频，如耐心的解释工作原理、通俗的讲解等细节可知，用专业来形容Brenndt更合适。,,,,,,,,,,
42,https://www.youtube.com/watch?v=DMkeDn_ATrI,26:18,vlog - 派对,1,What kind of business does One Size Studio Headquarters mainly engage in? ,通用知识推理,Makeup and styling business.,One Size Studio Headquarters carried out the makeup and styling related to the characters from Shrek for them. ,Blesiv等人前往One Size Studio Headquarters，由Patrick Star及其团队为他们进行与《怪物史莱克》角色相关的化妆造型，Patrick 之前曾为博主打造过Edward Scissor Hands等标志性造型。,,,,,,,,,,
,,,,2,Who is in charge of the KAED channel on YouTube?,通用知识推理,Eddie and Karen.,Karen and Eddie's channel is responsible for shooting and releasing the full-process video of the party. ,Blesiv称他只记录了派对开始前的准备，Karen和Eddie的频道负责拍摄并发布派对的全程视频，最后呼吁观众想要了解派对内容订阅KAED频道。,,,,,,,,,,
,,,,3,Is Blesiv more introverted or more extroverted?,"多线索推理,人物属性建模",More extroverted.,,Blesiv兴奋地筹备派对，全程积极拍摄Vlog并和朋友们畅快交流。,,,,,,,,,,
,,,,4,What's Patrick's job?,人物属性建模,Makeup stylist.,,Patrick能够根据不同人的情况，是否佩戴假体来规划化妆时间，还能为大家打造出还原《怪物史莱克》角色的妆容，并且他还有自己的团队，所以可以推断出他的职业是化妆师。,,,,,,,,,,
,,,,5,"During the makeup and styling process, who took the longest time?","多跳推理,多模态/多语言推理",Eddie.,,在化妆造型这个片段，听觉Blesiv因为不需要假体需要的时间最短，Eddie和Karen因为假体提前一个小时开始，视觉Karen优先完成离开座位。,,,,,,,,,,
43,https://www.youtube.com/watch?v=19XeVT8O810,23:26,综艺 - 表演/选秀,1,Do singing performances account for the majority of the shows in America's Got Talent? ,通用知识推理,"No, it's a comprehensive talent show. ",美国达人秀的舞台上，有很多类型的表演节目。, 美国达人秀舞台表演节目有喜剧，唱歌，杂技类表演等。,,,,,,,,,,
,,,,2,"In America's Got Talent, what signs do the judges give to represent that the contestants have succeeded? ",通用知识推理,"The judge's ""yes"" means the performer succeeds. ",美国达人秀节目中，评委说‘yes’，代表选手成功了。,通过观察美国达人秀的选手们表演和评委的行为，可以得知问题答案。,,,,,,,,,,
,,,,3,Is Heidi an extrovert or an introvert?,人物属性建模,She is a very outgoing person.,,根据Heidi在节目中的表现，以及她对理查德歌曲的表白可以看出她是一个很外向的人。,,,,,,,,,,
,,,,4,Did Richard's song on stage almost get the entire audience excited? ,多线索推理,Yes.,,模型先定位到理查德在台上唱歌的片段，观察全场观众的表现，可以看出几乎全场的观众都被他的歌声所吸引。,,,,,,,,,,
,,,,5,What is the relationship between Heidi and Richard?,人物属性建模,Married couple.,,根据美国达人秀节目支持人在舞台上宣布，理查德和海蒂结婚了，可以得知他们现在是已婚夫妇的关系。,,,,,,,,,,
44,https://www.youtube.com/watch?v=GTDjHG9FFCI,34:35,测评 - 美妆产品,1,What is Jeffree's least favorite makeup step?,人物属性建模,Draw the eyebrows.,,Jeffree自己讲述不喜欢在眉毛上画画，今年他更加喜欢外星人的造型，他非常反对棕色眉毛，他已经很久没有画过眉毛了，由此可推断得到。,,,,,,,,,,
,,,,2,What kind of foundation does James like?,人物属性建模,The Too Faced Born This Way foundation.,,视频中两人进行模仿对方标志性妆容挑战互换化妆包，Jeffree表示James化妆包中是Too Faced Born This Way粉底液，James也表示对该粉底液的认可。由此可推断。,,,,,,,,,,
,,,,3,What did James do before officially starting to do the makeup?,多跳推理,James used a glue stick to cover his eyebrows.,,James观察Jeffree的标志性妆容是没有眉毛的因此他决定化妆之前第一步是用胶棒将自己的眉毛给盖住，由此可推断。,,,,,,,,,,
,,,,4,Do you need to meet many conditions to use the 'JAMES' code?,通用知识推理,No.,在视频中Jeffree问James这个代码Lily和他有没有权利使用，James Charles讲述他代码'James'是他和每一个人都拥有的权力。,在视频中Jeffree问James这个代码Lily和他有没有权利使用，James Charles讲述他代码'James'是他和每一个人都拥有的，由此可推出这个代码的使用是没有任何加成条件限制的。,,,,,,,,,,
,,,,5,"Is the 'JAMES' code only applicable to one brand, Morphe?",通用知识推理,No.,Jeffree的讲述使用代码‘James’在购买Morphe化妆刷时可以打九折，James讲述了使用该代码可以在购买Lily 睫毛刷、OFRA液体唇釉等都可以打九折。上述Lily和ofra 都是不同的彩妆品牌。,基于视频中Jeffree的讲述使用代码‘James’在购买Morphe化妆刷时可以打九折，后面James讲述了使用该代码可以在购买Lily 睫毛刷、OFRA液体唇釉等都可以打九折。上述Lily和ofra 都是不同的彩妆品牌，由此可推出。,,,,,,,,,,
45,https://www.youtube.com/watch?v=tgp8RCbhinA,33:40,vlog - 居家,1,What is the name of Shark Ninja?,通用知识推理,It is the name of the manufacturer of the coffee machine.,Shark Ninja是咖啡机生产商的名字。,马拉·斯努巴尔说Shark Ninja寄给了她一台浓缩咖啡机，可推测Shark Ninja是咖啡机生产商的名字。,,,,,,,,,,
,,,,2,Is Mara Snoubal a skincare person?,人物属性建模,She is a skincare person.,,马拉·斯努巴尔每天晚上都会敷LED面膜，可知她是个注重护肤的人。,,,,,,,,,,
,,,,3,What do people do on the night of Ramadan?,通用知识推理,Pray and kneel.,在斋月期间，祷告和跪拜是每天的固定仪式。,马拉·斯努巴尔一家在晚上要进行祷告，结合她说这个视频记录了斋月完整的一天晚上，能够推出在斋月期间，祷告和跪拜是每天的固定仪式。,,,,,,,,,,
,,,,4,Does Malik like ice cream?,人物属性建模,"Yes,he is.",,马里克在祷告结束后和他的爸爸妈妈说要吃冰淇淋，可见他喜欢吃冰淇淋。,,,,,,,,,,
,,,,5,What does Malik need to do before going to bed?,多跳推理,Step on the stool and go to bed.,,马里克上床前要把凳子推到床边然后踩着凳子上去。,,,,,,,,,,
46,https://www.youtube.com/watch?v=XtRd7qitotM,26:09,vlog - 运动,1,Whose name is the panda?,多模态/多语言推理,The panda is a horse.,,博主介绍卡门要来骑熊猫，镜头展示时，结合视觉，可知熊猫是一头马。,,,,,,,,,,
,,,,2,What is the relationship between Carmen and the blogger?,人物属性建模,They are friends.,,根据博主讲述可知她与卡门是朋友关系。,,,,,,,,,,
,,,,3,How to control the direction when riding a horse?,通用知识推理,Control the length of the reins.,骑马时可以通过控制缰绳的长短来改变方向。,根据卡门骑马时转弯时改变缰绳长短可推出骑马时可以通过控制缰绳的长短来改变方向。,,,,,,,,,,
,,,,4,Is Carmen an excellent horseback rider?,人物属性建模,"Yes,she is.",,卡门第一次骑熊猫就骑得很好，说明她马术很好。,,,,,,,,,,
,,,,5,How to keep your horse's head down while riding?,通用知识推理,Relax the reins and slap the horse on the neck.,骑马时，可以通过放松缰绳和拍打马儿的脖子示意马儿低头。,博主说让马的头低下去可以将手往前伸，然后将缰绳放回去，视频中可以看到缰绳处于放松状态，没有被拉紧，结合卡门拍了拍马儿的脖子，然后马儿的头就低下去了，可知骑马时，可以通过放松缰绳和拍打马儿的脖子示意马儿低头。,,,,,,,,,,
47,https://www.youtube.com/watch?v=E5UTXbugdZc,20:28,vlog - 居家,1,What kind of animal is the peluche buddy Jayco was talking about?,多模态/多语言推理,It's a dog.,,Jayco和Val在展示他们的行李包之前让镜头前的毛绒朋友让开，结合视觉可知毛绒朋友是一条狗。,,,,,,,,,,
,,,,2,What is Jayco's occupation?,人物属性建模,Jayco is a clothing brand owner.,,视频中Jayco介绍了他即将发布的一些服装，他的职业是一名服装品牌主理人。,,,,,,,,,,
,,,,3,"What is the name of "" JESUS IS LOVE""?",通用知识推理,It is the name of a clothing line.,” JESUS IS LOVE“是服装系列的名字。,"Jayco介绍他将发布"" JESUS IS LOVE""系列的衣服，可知"" JESUS IS LOVE""是衣服的名字。",,,,,,,,,,
,,,,4,"Are Jayco and Val an attentive, prepared couple?",人物属性建模,Yes.they are.,,Jayco和Val在孩子未出生前准备了待产包，考虑到了生产可能用到的所有东西，可见他们是一对喜欢提前做准备，细心耐心的夫妻。,,,,,,,,,,
,,,,5,Why should girls try not to wear rings during pregnancy?,通用知识推理,Because the fingers will become swollen and enlarged.,女生在孕期手指会水肿变大，尽量不要带戒指。,根据Val所讲她在生孩子前会把戒指摘掉，推测怀孕会让女生手指水肿变大。,,,,,,,,,,
48,https://www.youtube.com/watch?v=APinK3ijfiQ,37:44,教学 - 医疗,1,Is Sam Herbert a brave person or a timid person ?,"多线索推理,人物属性建模",He is a brave person.,,视频内容：Sam Herbert在街上遇到有人心脏病发挺身而出用自己掌握的急救知识拯救了一个人的性命。——>推理：Sam Herbert是一个勇敢的人。,,,,,,,,,,
,,,,2,Which kind of patient should be placed in the recovery position during first aid?,"多模态/多语言推理,通用知识推理",Patients who are unconscious but breathing normally should be placed there.,Recovery position（恢复体位）是一种用于无意识但有正常呼吸的患者的急救体位。它的目的是保持气道通畅，防止呕吐物、血液或其他液体阻塞呼吸道，减少窒息风险。,视频内容：在急救教学演示恢复体位的过程中，根据听觉Shyr-Nai提到当前患者虽然昏迷但仍有呼吸，通过视觉观察之后她开始教学如何把患者摆成恢复体位。——>推理：昏迷了但仍有呼吸的患者需要在急救时被摆成恢复体位。,,,,,,,,,,
