,,,,3,Is Tom Wilkes a persistent person?,人物属性建模,"Yes, he is.",,视频内容：Tom Wilkes提到自己从小学参加急救课程开始就对参与急救工作开始感兴趣，并一直从事这个领域。——>推理：Tom Wilkes是一个坚持的人。,,,,,,,,,,
,,,,4,Who was interviewed after Sam Herbert ?,多跳推理," David Herbert, Sam's father.",,模型需要定位到与Sam Herbert采访相关的片段，然后结合前后内容进行分析。,,,,,,,,,,
,,,,5,How to open the airway of an unconscious person ？,通用知识推理,Head-Tilt Chin-Lift Maneuver.,Head-Tilt Chin-Lift Maneuver（仰头抬颏法）是一种用于打开气道的急救技术，常用于没有颈椎损伤风险的无意识患者，尤其是在心肺复苏过程中。,视频内容：在演示急救过程时，Adam演示了如何为昏迷的人打开气道：把两根手指放在下巴下面，把手放在的头顶上，把头往后仰，然后抬起下巴。——>推理：为昏迷的人打开气道需要用到仰头抬颌法。,,,,,,,,,,
49,https://www.youtube.com/watch?v=DcQirGief28,35:34,探索 - 参观,1,Why are all the drinks in bars non-alcoholic in Saudi Arabia?,"多模态/多语言推理,通用知识推理",Because alcohol is banned in Saudi Arabia.,Saudi Arabia is an alcohol-free country.,根据语言和画面找到酒吧出现的位置，再据此判断出里面的酒为何都不含酒精。,,,,,,,,,,
,,,,2,What's the relationship between Kara and Nate?,"多线索推理,人物属性建模",They are husband and wife.,,根据线索找到Kara和Nate，再根据他们的行为判断出他们之间的关系。,,,,,,,,,,
,,,,3,Does the minibar in the SHEBARA require an additional fee to use?,"多模态/多语言推理,通用知识推理","The minibar is included in the accommodation fee, so there is no additional charge.",酒店中的物品通常使用都需要额外付费，但已经包含在住宿费范围内的不需要再付费。,需要根据语音和画面找到相关使用迷你酒吧的片段，并据此判断出是否需要为此额外付费。,,,,,,,,,,
,,,,4,Did Kara guess exactly what the waiter put in her matcha coffee?,多线索推理,"No, she didn't.",,需要先定位到Kara喝抹茶咖啡的时间段，再据此判断她是否知道里面加了什么。,,,,,,,,,,
,,,,5,What is GUS's profession?,人物属性建模,He is the manager of a restaurant.,,找到Gus出现的片段，并据此判断出答案。,,,,,,,,,,
50,https://www.youtube.com/watch?v=VDixvAoDVeY,33:51,教学 - 艺术,1,Is Kevin's dad a determined person?,"多线索推理,人物属性建模","Yes, he is.",,视频内容：Kevin爸爸作为初学者可以坚持每天抽出时间来做吉他的指法练习。——>推理：Kevin爸爸是一个有毅力的人。,,,,,,,,,,
,,,,2,Does Kevin have a good relationship with his dad?,"多线索推理,人物属性建模","Yes, he does.",,"视频内容：Kevin在教学过程中可以和爸爸开各种玩笑，包括说如果爸爸不坚持练习他就会”kill him""、Kevin让爸爸做指法练习是自己喜欢”折磨爸爸“。——>推理：Kevin和他爸爸的关系很好。",,,,,,,,,,
,,,,3,What practice should a beginner guitarist do every day?,通用知识推理,Chord change exercise and spider exercise.,Chord change exercise 指的是吉他练习中用于训练和改善和弦转换的练习，而The Spider Exercise是一种经典的吉他手指独立性和灵活性练习。,视频内容：Kevin提到建议初学者每天练琴40分钟，其中十分钟练习和弦转化，十分钟练习蜘蛛练习。——>推理：吉他初学者每天都需要做的练习是和弦转换和蜘蛛练习。,,,,,,,,,,
,,,,4,"When doing the spider routine, what position should practitioners keep their fingers in?",通用知识推理,The fingers should be kept close to the fretboard.,在练习spider routine时，保持手指靠近指板，可以减少不必要的手指抬高动作，从而提高换弦和指法的效率，同时降低手部的紧张感和疲劳。,视频内容：Kevin反复强调在在练习spider routine时，要努力不把手指抬高，而是要尽量贴近指板。——>推理：在练习spider routine时，要保持手指贴近指板的姿势。,,,,,,,,,,
,,,,5,What did Kevin do after talking the method of increasing speed on  chord change exercises ?,多跳推理,He showed this exercise in person.,,模型需要定位到与Kevin讲解chord change exercise提高速度的方法相关的片段，然后结合前后内容进行分析。,,,,,,,,,,
51,https://www.youtube.com/watch?v=YhNfeejuByI,22:12,测评 - 电子产品,1,What kind of geographical environment is mostly used for the flight tests of Wing's aircraft?,通用知识推理,Deserts and open fields.,基于Adam woodworth对应整个公司飞行测试的初步介绍可以知道，Wing公司主要在沙漠和空旷田野进行测试。,基于Adam savage与wing公司工程师沟通可以知道，在厂房的大多数时间都是在沙漠或者空旷田野进行飞行测试，由此可以得出结论。,,,,,,,,,,
,,,,2,Does Adam Savage highly appreciate and identify with FA or not?,人物属性建模,He holds a very approving attitude.,,Adam savage视频中表示他非常欣赏FA，因为它具有高清晰度的安全过程，允许他人匿名举报且不会受到惩罚，去确保它自己的状态，通过Adam的语言描述可以推论。、,,,,,,,,,,
,,,,3,How many aircraft crash experiments did the Wing team conduct in the video?,多线索推理,Twice.,,在视频对应测试片段，可知为了让Wing团队更好的记录整个飞机坠毁实验的过程，Wing团队进行两次实验，实验的撞击平整度也不同，由此可以推断。,,,,,,,,,,
,,,,4,Is Adam Woodworth an enthusiast of aircraft design?,人物属性建模,Yes.,,基于视频Adam savage对Adam woodworth的表述“you spend your whole life to build aircraft ”，在创建这恶鬼无人飞机时子啊政策方面受到很多压力，但是仍然坚持设计飞机，由此可推断得出。,,,,,,,,,,
,,,,5,Are Wing's aircraft as safe as commercial aircraft?,通用知识推理,No.,视频可知Wing正在飞行测试，希望将自家飞机的飞行安全与商用飞机一样。,通过Adam savage的采访可以知道Wing团队在长时间记录飞行状况，然后尝试将自家飞机的飞行安全与商用飞机一样。通过这些可以推断出结论。,,,,,,,,,,
52,https://www.youtube.com/watch?v=5gynj76XsUQ,27:06,纪录片 - 自然,1,What is Mark's occupation?,人物属性建模,He is a photographer.,,马克以保护的名义拍摄了数百次极限冒险可知他的职业是一名摄影师。,,,,,,,,,,
,,,,2,Why is RN2 one of the most dangerous roads in the world?,通用知识推理,The emergence of terrorist organizations and rebel militias.,恐怖组织、叛乱民兵滋生导致非洲社会动荡，也让RN2成为了非洲乃至全世界最危险道路之一。,从马克的话中我们可以推断出恐怖组织、叛乱民兵滋生导致非洲社会动荡，也让RN2成为了非洲乃至全世界最危险道路之一。,,,,,,,,,,
,,,,3,Was Augustine a man who did not fear life or death and loved animals?,人物属性建模,Augustine was a brave and animal-loving person.,,奥古斯丁作为护林员，不惧怕恐怖分子，愿意为保护大猩猩献出生命，说明他是个不惧生死，热爱动物的人。,,,,,,,,,,
,,,,4,Why do gorillas build new nests every day?,通用知识推理,Gorillas pull feces into their nests every day.,大猩猩每天会在自己的巢穴里拉粪便。,马克说大猩猩每天都会筑一个新巢，因为没有人愿意回家后看到一个脏兮兮的巢穴，结合视频可以看到在大猩猩的窝里有很多粪便，可以推测大猩猩的生活习惯就是每天会在自己的巢穴里拉粪便，所以它们每天都要搭建新巢穴。,,,,,,,,,,
,,,,5,What precautions did Mark take before meeting the gorilla?,多跳推理,He was wearing a mask.,,因为大猩猩与人类的DNA高度重合，为了预防大猩猩身上的传染病，马克在遇见大猩猩之前戴了口罩。,,,,,,,,,,
53,https://www.youtube.com/watch?v=sxbGmqfmfBE,28:45,街头互动 - 社会观察,1,What is April O'Connor's attitude towards her job? ,"多线索推理,人物属性建模",Enthusiastic.,,通过视频中 April O'Connor提到自己的工作过程时，他说自己就像神奇的女巫一样，并且很高兴能帮助饥饿的人。,,,,,,,,,,
,,,,2,Is Kimmy Murray living a life beset by difficulties or a life of happiness?,人物属性建模,A life beset by difficulties.,,视频中Kimmy Murray提到没人渴望自己现在的生活，并且提到自己身体的问题，生活上的困境，还得不到政府的帮助。,,,,,,,,,,
,,,,3,"Can the homeless people in Portland, Oregon apply for government assistance or can they only rely on themselves?",通用知识推理, They can apply for government assistance.,关于俄勒冈州波特兰会为无家可归的人提供的援助。,视频中可以看到，在波特兰，无家可归的可以居住在政府提供的庇护所中，并且还可以看到，存在组织为无家可归的人提供早餐，有一对无家可归的人的夫妻也向政府提交过请求援助的申请。,,,,,,,,,,
,,,,4,Who is Skyler's mother?,多线索推理,Tiana.,,视频中Tianna介绍自己的生活，提到每当自己沮丧时，Skyler就会跑来叫自己妈妈并且安慰自己。,,,,,,,,,,
,,,,5,What is the purpose of the people in Portland staging a night strike?,"多线索推理,通用知识推理",To help the homeless.,关于波特兰的夜间罢工活动是什么，以及从事的活动,视频中安东尼在介绍夜间罢工活动时，提到这是一个志愿活动，主要是为那些无家可归的人提供一些基础的服务，可以得出结论。,,,,,,,,,,
54,https://www.youtube.com/watch?v=sbT04og2veo,28:25,纪录片 - 自然,1,What is Antonio Basa's attitude towards the prospect of the olive - growing industry?,人物属性建模,Pessimistic.,,根据视频中Antonio Basa表示下一代人已经不愿意进入这个产业而且自己也打算退出可以看出他对橄榄产业的发展前景持悲观态度。,,,,,,,,,,
,,,,2,What are the differences between organic agriculture and traditional agriculture?,通用知识推理,Organic agriculture does not use chemical substances.,有机农业不使用化学肥料和杀虫剂、除草剂,根据视频内容中Antonio Puentes对有机橄榄油种植的介绍推断出有机农业与传统农业的不同。,,,,,,,,,,
,,,,3,Can Antonio Basa herd livestock?,人物属性建模,"Yes,he can.",,根据视频内容 Antonio Basa不仅种植橄榄，根据画面显示他还养一大群羊，可以看出他会放牧。,,,,,,,,,,
,,,,4,Which types of seasonings are specially protected in supermarkets in Spain?,通用知识推理,Olive oil.,橄榄油在西班牙超市中有特别的保护措施,根据视频内容西班牙超市中的橄榄油采用了安全锁或者锁在柜子里等一系列安全措施。,,,,,,,,,,
,,,,5,Is it easy to catch the people who steal olives?,多线索推理,"No,it isn't",,根据视频内容政府和农民采取了各种方法试图抓住小偷但是都以失败告终。,,,,,,,,,,
55,https://www.youtube.com/watch?v=EwSaZfwBrz8,36:26,访谈 - 静态（对话密集型，少量视觉信息）,1,Does glass belong to anisotropic materials?,通用知识推理,Glass is not an anisotropic material.,玻璃是否属于各向异性材料,根据James所说复合材料属于各向异性材料，不像钢、钛和玻璃那样，由此推出,,,,,,,,,,
,,,,2,When was the wreck of the Titanic discovered?,"多线索推理,通用知识推理",1985,泰坦尼克号残骸被发现的时间,根据James说第一次潜水进入泰坦尼克号是1995年，而且在十年前被发现，由此推出发现时间是1985,,,,,,,,,,
,,,,3,How many materials does James mention that can be used in pressure vessels?,多线索推理,Four,,模型需要分析并统计James提到的材料中哪些是可以用于压力容器的,,,,,,,,,,
,,,,4,Is James a cautious person?,人物属性建模,Yes,,根据James对潜艇要求严格，每个零件都要经过检验合格并且拒绝Stockton的邀请可以看出,,,,,,,,,,
,,,,5,Is Stockton an egomaniac?,"多线索推理,人物属性建模",Yes,,根据Stockton从航天领域转到潜水领域却不愿听从别人建议，对自己出格的设计自豪可以看出他的自负,,,,,,,,,,
56,https://www.youtube.com/watch?v=1EXwk_quVv4,35:20,纪录片-历史纪实,1,Is the blogger erudite?,人物属性建模,Yes,,博主能流畅地介绍肯辛顿宫的历史，馆长讲完肯辛顿宫的壁画和一些宫女的服装后博主还能补充馆长的话,,,,,,,,,,
,,,,2,What are the restrictions for taking up the position of a bridesmaid at Kensington Palace?,通用知识推理,Young women of noble birth,只有出身名门的年轻女性才能从事肯辛顿宫伴娘一职,博主提到活跃宫廷气氛是一群年轻女性的工作，它们被称为伴娘，她们必须出身名门教养良好，可推断出,,,,,,,,,,
,,,,3,"In the 18th century, were there more men or women holding special positions in the British royal palace?",通用知识推理,Men,18世纪，英国皇宫的特殊职位男性担任较多,视频提到这些工作通常由男性担任，偶尔有女性担任的情况，可推断出,,,,,,,,,,
,,,,4,Is Mrs. Silka a considerate person or an unfriendly one?,人物属性建模,A considerate person,,Bernie说Silka是一个令人愉快的女人，如果不是她把衣服按顺序给女王，她根本不知道要按什么顺序，可推断出,,,,,,,,,,
,,,,5,What might be the dessert that George II might have after his meal?,多线索推理,Macarons and cheese,,视频中先提到了介绍的物品是乔治二世的大厨的厨房笔记，后面又提到有趣的是早在1736年就出现了马卡龙和奶酪，可推断出乔治二世的饭后甜点可能有马卡龙和奶酪,,,,,,,,,,
57,https://www.youtube.com/watch?v=zcyd8OXccCg,21:15,测评 - 电子产品,1,What is JACK's job??,"多线索推理,人物属性建模,多模态/多语言推理",He is a clerk at MICROCENTER.,,找到jack出现的片段，并根据他的言行判断出答案。,,,,,,,,,,
,,,,2,"Which computer retailer does the author prefer, Micro Center or Best Buy?","多线索推理,人物属性建模",Micro Center.,,找到作者比较俩家电脑的片段，并根据作者的反应得出答案。,,,,,,,,,,
,,,,3,"In terms of VRAM performance, how does the RTX 4060 GPU compare to the RTX 3060 GPU?",通用知识推理,The RTX 4060 performs better.,4060系显卡比3060系显卡功能要好。,找到相应谈论显卡的片段，并推理出答案。,,,,,,,,,,
,,,,4,what can be used to control the color change of a computer case?,通用知识推理,Install a LED switch.,LED可以控制灯光颜色变化。,找到对应机箱装载LED灯发光片段，并根据画面与语音推理出答案。,,,,,,,,,,
,,,,5,"Compared with MICROCENTER and BESTBUY, which one has better service attitude?",多线索推理,Micro Center.,,找到分别在两家店铺购物的片段，并根据画面与人物各自的反应得出答案。,,,,,,,,,,
58,https://www.youtube.com/watch?v=J1q1VsXw2tU,33:52,综艺 - 表演/选秀,1,Which animals performed on the stage?,"多线索推理,多模态/多语言推理","Rabbits, dogs, pigs and chickens.",,模型需要读取视频，通过语言和画面去识别视频中进行表演的小动物，由此可知有兔子、狗、猪和鸡。,,,,,,,,,,
,,,,2,What is Sofia Vergara most afraid of?,人物属性建模,The black ocean.,,在Jode Rijk达人秀表演时请在场评委写下自己最为恐惧的事情，Sofia Vergara在节目纸上写下的是Dark ocean，与此可知她最为恐惧的事物。,,,,,,,,,,
,,,,3,What kind of job was Sethward interested in? ,人物属性建模,Performing.,,在Sethward进行达人秀表演之前，他在采访中讲述说他家中每个人都找寻到自己所热爱的事物，他热爱表演，他特别喜欢观察大自然，在大自然中找寻表演灵感，由此可以推出他热爱大自然。,,,,,,,,,,
,,,,4,Is the show America's Got Talent a variety show that allows animals to perform directly on stage?,通用知识推理,Yes.,基于视频中Jode携带他的宠物鸡 Rijk上台表演，可知该达人秀舞台是允许动物直接上台表演的。,基于视频中Jode携带他的宠物鸡 Rijk上台表演，以及后续猪上台表演，都可以发现，该达人秀舞台是允许动物直接上台表演的。,,,,,,,,,,
,,,,5,Are the performance stage and the judges' platform of America's Got Talent connected to each other?,通用知识推理,Yes.,视频中Jode与他的宠物鸡Rijk一同表演魔术时，Jode径直走过两个平台之间的连廊到达评委面前表演魔术，由此可知两舞台之间时连接的。,视频中Jode与他的宠物鸡Rijk一同表演魔术时，Jode径直走过两个平台之间的连廊到达评委面前表演魔术，由此可知两舞台之间时连接的，由此可推断。,,,,,,,,,,
59,https://www.youtube.com/watch?v=gnhub9-KLsE,33:11,测评 - 美妆产品,1,What does Jeffree Sta usually use to remove makeup? ,人物属性建模,Makeup remover pads.,,基于视频种Jeffree Star的表述他不喜欢一系列泡沫产品，他一般会用全卸妆棉来清洁，然后卸妆，由此可推断。,,,,,,,,,,
,,,,2,How many products of Kylie Skin were tested?,多线索推理,Six products.,,视频中Jeffree Star在不同视频片段讲述此次测试面部保湿霜、卸妆湿巾、核桃磨砂面霜、眼霜、香草牛奶爽肤水、泡沫洗面奶和维生素C精华液，由此可知是6种产品。,,,,,,,,,,
,,,,3,Are the skincare products launched by Kylie Skin all of extremely strong efficacy?,通用知识推理,No., Jeffree 和 Shane Dawson测试Kylie Skin的卸妆巾，产品让脸部感到非常干燥；在测试Kylie 眼霜时发现在成分中有功效性的成分都排在配料表最后；最后两个人在测试面霜等一系列产品后基于脸部感知认为产品非常基础性, Jeffree 和 Shane Dawson首先测试Kylie Skin的卸妆巾，两人在试用以后都非常认同卸妆湿巾让脸部感到非常干燥；在测试Kylie 眼霜时发现在成分中有功效性的成分都排在配料表最后；最后两个人在测试面霜等一系列产品后认为产品非常基础性且与价格不相符，基于测试结果可推断。,,,,,,,,,,
,,,,4,Is the relationship between Jeffree and Kylie Jenner friendly or broken?,人物属性建模,The relationship between the two people is broken.,,基于Jeffree 讲述在谈论有关Kylie的品牌产品时，人们都会考虑过去他与Kylie之间的事，但他们之间谁也不在乎谁，不存在强烈敌意，期间Jeffree的真实语言和便请等综合可知两人关系不好。,,,,,,,,,,
,,,,5,Which ingredient-containing toner should be avoided?,通用知识推理,Alcohol.,视频中在介绍Kylie Skin的爽肤水时，介绍其中成分时Jeffree 讲述这个产品不包含酒精非常良心，因为有酒精的产品会一定程度加速衰老。,视频中在介绍Kylie Skin的爽肤水时，介绍其中成分时Jeffree 讲述这个产品不包含酒精非常好，因为有酒精的产品会让人随着时间加速衰老。,,,,,,,,,,
60,https://www.youtube.com/watch?v=kCbrz1q-6gY,26:56,综艺 - 纪实（真人秀）,1,Where do the live audience of the Master Chef Canada generally be located to watch the show? ,"多模态/多语言推理,通用知识推理",On the second floor of the show venue.,All the audience are on the second floor of the show venue in the Master Chef Canada.,视频为节目的精彩集锦，听觉有厨师的家属等人的声音为厨师加油，视觉所有出现观众的画面都在室内现场二楼站着看。,,,,,,,,,,
,,,,2,What is Miranda's mother's occupation?,人物属性建模,A chef.,,Miranda讲述自己是跟妈妈学习，以及妈妈以糖霜闻名，推测妈妈也是个厉害的厨师。,,,,,,,,,,
,,,,3,Does Christopher's cooking style tend to be traditional classic or innovative fusion?,"多线索推理,人物属性建模,多模态/多语言推理",Innovative fusion.,,听觉Christopher介绍自己做的菜，视觉他的菜的摆盘以及制作过程。,,,,,,,,,,
,,,,4,Is a whole fish as a dish common on the dining tables on the East Coast of the United States? ,通用知识推理,No.,"Fish dishes on the East Coast are usually presented in the forms of fish fillets, fish steaks and so on. ",Jennifer来自东海岸，表示自己从来没有处理过一条完整的鱼，即使她是一名厨师，说明这个地区的餐桌上直接将一条完整的鱼作为菜肴并不常见。,,,,,,,,,,
,,,,5,"Among all the dishes, who received a bad evaluation from the judges? ",多线索推理,Nobody.,,综合所有菜品完成后的评委评价可知。,,,,,,,,,,
61,https://www.youtube.com/watch?v=f1b13DjXU18,21:25,纪录片-历史纪实,1,What is Gus Hales' attitude towards the British government?,"多线索推理,人物属性建模",He holds a strongly critical attitude.,,Gus认为英国政府通过remembrance Bush美化战争，并利用家庭协会掩盖真相，提到英国政府操控舆论等。,,,,,,,,,,
,,,,2,Is Ben proud of being a member of the SAS troops?,人物属性建模,No.,,Ben在SAS执行任务时会闯入民宅，带走所有手机、钱、武器、电脑、证件等物品，而被带走的人会被送往监狱遭受酷刑，他意识到自己的行为与萨达姆的爪牙相似，最终拒绝返回伊拉克。,,,,,,,,,,
,,,,3,What is the most core and main form of opposition in West Belfast?,通用知识推理,Political opposition based on sectarian differences.,The different religious sects in West Belfast have led to fundamental differences in political stances. ,贝尔法斯特西部约90%是天主教民族主义者和共和党人，而剩下约10%是联合主义者，双方在政治立场上存在根本分歧，天主教民族主义者和共和党人倾向于与爱尔兰统一，而联合主义者则希望维持与英国的联盟关系。,,,,,,,,,,
,,,,4,What is the core motivation for IRA members to shift to peace work? ,通用知识推理,Experience of long-term imprisonment and political compromise of the Good Friday Agreement. ,"Seanna was released due to the Good Friday Agreement, and Tommy had the experience of being imprisoned several times. ",Joe希望通过自身经历，让年轻人认识到冲突对社区的危害，Seanna在1998年依据《耶稣受难日协议》获释，该协议为IRA成员提供了政治上的妥协空间，推动他们放下武器，转向和平工作，Tommy有着多次被捕入狱的经历，长期的监禁生活让他深刻体会到冲突带来的痛苦，进而促使他在出狱后致力于推动社区和解。,,,,,,,,,,
,,,,5,Are other people all holding a positive attitude towards the reflections of former British soldiers? ,多线索推理,No.,,IRA成员如Joe、Danny对前英军士兵的反思持相对开放和欢迎的态度，部分受害者家属对前英军士兵的反思持怀疑或保留态度。,,,,,,,,,,
62,https://www.youtube.com/watch?v=pgk-719mTxM,38:34,教学 - 课堂互动,1,What is the relationship between Mr. Hester and Miss Slack?,人物属性建模,They are colleagues.,,Mr. Hester提到学生的活页夹只有在英语课和Miss Slack的演讲与作文课上可以共用，说明他们在同一所学校教学，且课程有联系。,,,,,,,,,,
,,,,2,Does Mr. Hester value time management? ,"多线索推理,人物属性建模",Yes.,,Hester在布置任务会限定时间并设置闹铃，还会计时学生交作业的速度，对于学生交作业速度越来越快表达夸奖。,,,,,,,,,,
,,,,3,Which educational tier does LPS Richmond belong to?,通用知识推理,Secondary education.,The ninth grade classroom.,该课堂为九年级的课堂，相关作业布置都是针对九年级学生，老师提到学生成绩比所在地区其他公立高中高，要帮助学生进入好大学。,,,,,,,,,,
,,,,4,How can teachers optimize the homework submission process to improve efficiency in classroom management?,通用知识推理,Plan homework relay routes and set up speed competitions.,The teacher designs a relay-style homework delivery system.,老师通过提前规划作业传递的路径减少混乱，并用传递速度竞赛来提升学生的参与动机，效果很好，学生交作业的速度越来越快。,,,,,,,,,,
,,,,5,"When assigning the letter homework, does Mr. Hester force students to write according to the template? ",多跳推理,No.,,在布置信件作业片段，老师要求学生写一封信介绍自己，信不能留超过三行空白，至少要写到指定的横线处，可选择在给定的纸上依据模板写，也可从空白纸张写。,,,,,,,,,,
63,https://www.youtube.com/watch?v=hjvvkCB87Co,41:59,教学 - 艺术,1,What is David Marvel's job? ,人物属性建模,He is a painter.,,视频中作者在介绍David时，提到了他的优秀绘画做饼，并且从他那里订购了一幅画，可以推断出结果。,,,,,,,,,,
,,,,2,How many times did David Marvel pour colors into the first plastic cup?,多线索推理,Sixteen times.,,通过视频中大卫在向塑料杯中倒入颜料的这个过程，可以看到总共倒入了16次颜料才结束。,,,,,,,,,,
,,,,3,"Which treatment should be carried out first during the fluid creation process, regularization or destruction?","多线索推理,通用知识推理",Regularization treatment.,关于流体艺术创作的一般流程,视频中，作者在教David制作时，现要求David对颜料的规则化约束，等这一步完成后，再打破规则化，实现作品创建。,,,,,,,,,,
